type,link,title,text
sports,https://theonion.com/physical-therapy-office-politely-declines-daniel-jones-1851605177/,"Physical Therapy Office Politely Declines Daniel Jones’ Offer Of Framed, Signed Jersey For Wall","EAST RUTHERFORD, NJ—Insisting repeatedly that they just didn’t have the space, physical therapy practice Elite Recovery politely declined New York Giants quarterback Daniel Jones’ offer Friday of a framed and signed game-worn jersey for the wall. “That’s so nice of you, and we wish we could put it up, but unfortunately, as you can see, our walls are already pretty full,” said physical therapist Courtney Bellingham, gesturing to walls sparsely adorned with jerseys from a New York Riptide lacrosse goalie, a Trenton Thunder minor league catcher, and a local  high school basketball player. “We really appreciate the offer, though. It’s so sweet. You know what? We can just hold onto it and keep it in the back, and if we ever expand our offices, we can put it up then.” At press time, after waiting to make sure the Giants quarterback had left the premises, Bellingham reportedly took the framed jersey and quietly tossed it in a dumpster behind the office."
sports,https://theonion.com/mlb-loses-millions-of-stats-in-warehouse-fire-1851601587/,MLB Loses Millions of Stats In Warehouse Fire,"SAN FRANCISCO—As front-office executives surveyed the damage done to their record-keeping facility, Major League Baseball announced Monday that it had lost millions of stats Monday in a devastating warehouse blaze. “It is with a heavy heart that I share  today the news of an accidental fire that has reduced to ash the millions of baseball statistics we have collected over more than a century,” said MLB Commissioner Rob Manfred, explaining that all players and teams, past and present, had been stripped of their titles and records, none of which could be independently verified without the lost data. “These were unfortunately the only copies of many of these stats that we had, meaning there is no hope of recovering the historic slugging percentages, earned run averages, or win-loss records of your favorite teams and players. Sadly, we no longer have any idea who has the most career home runs or no-hitters, and any theory as to why Babe Ruth, Willie Mays, or Pedro Martinez were so highly regarded is now squarely in the domain of speculation.” At press time, Manfred paid tribute to the brave souls who lost their lives attempting to save the stats for the 2003 Detroit Tigers."
sports,https://theonion.com/mlb-reminds-white-sox-that-games-televised-1851590284/,MLB Reminds White Sox That Games Televised,"CHICAGO—With the franchise on track to have what may be the single worst season in the modern history of the sport, Major League Baseball sought to remind the Chicago White Sox on Friday that the team’s games were televised. “Based on the way you’re playing, we just wanted to make sure you understand that there are people watching you—that pretty much anyone can go on TV and see what you’re doing on the field,” said MLB commissioner Rob Manfred, explaining that many, many Americans have cable and internet connections and can watch all the games the team is losing, as well as highlights of every White Sox batter who strikes out, every fielder who drops the ball, and every pitcher who, once again, allows the bases to become loaded. “The fact that there are people in the stands watching, however few, should be enough to make your team do something to get its act together, but that hasn’t happened.  Some of these people actually paid to watch you, which—baffling as that may be—ought to provide some kind of motivation. Right? Does any of what I’m saying making sense to you? We’re just trying to help here.” Reached for additional comment, Manfred emphasized that while no one actually wanted to watch the White Sox play, that wasn’t the point."
sports,https://theonion.com/caitlin-clark-supplements-rookie-salary-by-taking-adjun-1851573146/,Caitlin Clark Supplements Rookie Salary By Taking Adjunct Professor Of Basketball Job,"INDIANAPOLIS—Saying she figured she could do course prep while traveling to away games on the team bus, WNBA star Caitlin Clark told reporters she had begun supplementing her rookie salary this week with a second job as an adjunct professor of basketball. “I’m teaching a freshman-level Intro to Basketball Studies course on Mondays, Wednesdays, and Fridays and a senior seminar on dribbling Tuesdays and Thursdays,” the Indiana Fever guard said as she sat in a cramped cubicle during her scheduled office hours at Butler University’s Department of Basketball. “It’s only 20 paid hours a week and no benefits, but between this and my job with the Fever, I’m hoping to cover my basic living expenses. Plus, it gets my foot in the door in case a tenure-track position ever opens up—although those full-time professors of basketball never seem to leave. I don’t have an advanced degree or anything, but the students still call me Professor Clark, which is pretty cool.” Clark later confirmed she was commuting an hour to Bloomington so she could take night courses at Indiana University and eventually earn a Master of Basketball Arts and Sciences degree."
sports,https://theonion.com/wimbledon-trying-to-excite-us-but-the-ball-still-just-1851583183/,"Wimbledon Trying To Excite Us, But The Ball Still Just Goes Back And Forth All Day","LONDON—As the prestigious tennis event entered the quarterfinals, unenthused sources confirmed Tuesday that although Wimbledon continued to try to excite us, the ball still just went back and forth all day. “We really wish we could get excited by the ball going back and forth, but it’s simply not happening,” said shrugging tennis fan Gerald Firth, who spoke on behalf of everyone else in the crowd at the Grand Slam tournament, as well as those watching the matches on TV at home and anyone who happened to stumble across the purportedly thrilling highlights on news outlets around the world. “The same two guys hitting the ball there, then there, then there, then there, on and on for hours, despite ample opportunities for the ball to go somewhere else. Try two balls, maybe? Anything that isn’t one side, and then the other side. We  get the impression that we’re supposed to think playing on grass is cool or something, but that’s not really doing much for us in the way of entertainment. Then, even if we do manage to muster some excitement during the match, we’re not allowed to show it with clapping or cheering. We’re just kind of sitting here waiting for something to happen.” At press time, sources reported feeling briefly enthused by the prospect of a frozen lemonade from a Wimbledon vendor, but their indifference quickly returned after they deemed the concession totally overpriced."
sports,https://theonion.com/wimbledon-enters-third-round-of-centuples-tournament-1851582237/,Wimbledon Enters Third Round Of Centuples Tournament,Content not found
sports,https://theonion.com/caitlin-clark-brushes-off-23-stab-wounds-from-own-teamm-1851566816/,Caitlin Clark Brushes Off 23 Stab Wounds From Own Teammates,"LAS VEGAS—Following another highly physical game for the rookie point guard, Indiana Fever player Caitlin Clark reportedly brushed off the 23 stab wounds she received from her own teammates on the court Tuesday. “The physicality doesn’t bother me one bit—it’s all part of the game,” the pale and visibly woozy WNBA star said at a postgame news conference during which reporters questioned her reaction to the 23 knife-inflicted injuries suffered at the hands of her fellow Fever players and a pool of blood collected on the floor beneath her chair. “Emotions run high, and every once in a while that’s going to boil over into someone being brutally stabbed on the court multiple times. I really don’t take the coordinated effort to assassinate me personally. If anything, violently taking a shiv to my back, chest, and neck during a breakaway shows how much passion these women have for the game, and I’m lucky to play alongside them. In some ways, I’d even say it’s an advantage to be putting pressure on my jugular with my left hand while dribbling with my right. I’d be mad too if one of them got as much viscera on the ball as I did.” A stern Clark went on to tell the media that if she could pull the dozen or so blades out of her back and move on, they should be able to get over it too."
sports,https://theonion.com/rafael-nadal-withdraws-from-wimbledon-to-spend-more-tim-1851557229/,Rafael Nadal Withdraws From Wimbledon To Spend More Time Pressing Tennis Racket Against Face To Make Waffle Marks,"MANACOR, SPAIN—Expressing regret about missing “the amazing event,”  Rafael Nadal announced this week that he has officially withdrawn from Wimbledon in order to spend more time pressing his tennis racket against his face to make waffle marks, adding that he would now be referred to as Waffle Face. “As I near retirement, my team and I believe that the best use of my time right now would be to forgo Wimbledon to focus on smooshing my face with the racket,”said 22-time Grand Slam champion Waffle Face, pressing the nylon strings of his signature Babolat Pure Aero racket hard into his skin as his coach counted to 100. “I hope my fans will understand how important it is that I keep training my face to have a grid on it if I want to retire from tennis with the waffle-faceness that I have worked so hard for to achieve. Sadly, the marks go away after a minute or so, so I must stay in the zone, without any disruption, or else it will go back to being smooth, like a pancake. I do not wish to be a pancake. I am Waffle Face.” At press time, Novak Djokovic also announced his withdrawal from the tournament  while holding his racket an inch in front of his face, claiming that he was stuck in jail."
sports,https://theonion.com/relaxed-orioles-security-will-get-around-to-removing-fa-1851552393/,Relaxed Orioles Security Will Get Around To Removing Fan From Field In Another Inning Or So,"BALTIMORE—Vowing to eventually address the hooligan, relaxed Orioles security guard Rob McKenzie told reporters Monday that his crew would get around to removing a fan from the field in another inning or so. “Eh, he’s not hurting anyone, so what’s another inning or two of him sprinting around the diamond?” said McKenzie, explaining that the crazed fan, who had hopped the fence several innings before and begun zigzagging across the field, would tucker himself out at some point. “Who knows, he’ll probably get bored of trying to pants the batter soon and leave on his own. There’s plenty of innings left, so no huge rush.” At press time, sources confirmed the security guards finally got around to subduing the disorderly fan with deadly force."
news,https://theonion.com/movie-chyron-reads-davenport-ia-as-if-it-not-glaringly-obvious-establishing-shot-is-of-vander-veer-botanical-park/,"Movie Chyron Reads ‘Davenport, IA’ As If It Not Glaringly Obvious Establishing Shot Is Of Vander Veer Botanical Park","NEW YORK—In a move widely criticized as insulting the intelligence of viewers, a movie chyron reportedly drew outrage Wednesday for reading “Davenport, IA” as if it wasn’t glaringly obvious that the establishing shot was of Vander Veer Botanical Park. “Yeah, no shit we’re in Davenport, IA—do they really think I need that spelled out for me when I’m looking right at Vander Veer Botanical Park’s historic Grand Allée?” said moviegoer Marshall Helms, who added that he had half a mind to demand a refund if the movie was going to continue with the condescending bullshit. “I can infer the setting from Vander Veer’s iconic Stone Fountain without some stupid chyron holding my hand the whole goddamn time, thanks. It’s probably just for international viewers, but I still find it demeaning when films have so little faith in their audience. I’m not some uncultured swine who will see Davenport’s Municipal Rose Garden and confuse it for the fucking Quad City Botanical Center without the movie’s help.” At press time, Helms reportedly stormed out of the theater after a second chyron reading “November” was overlaid on an unmistakable shot of Vander Veer Conservatory’s annual Chrysanthemum Festival."
news,https://theonion.com/carnival-cruise-debuts-extravagant-all-inclusive-journey-to-edge-of-earth/,Carnival Cruise Debuts Extravagant All-Inclusive Journey To Edge Of Earth,Content not found
news,https://theonion.com/nobel-prize-in-physics-awarded-to-alien-giving-peace-sign-driving-tie-dye-vw-bug/,Nobel Prize In Physics Awarded To Alien Giving Peace Sign Driving Tie-Dye VW Bug,"STOCKHOLM—In a ceremony at the Royal Swedish Academy of Sciences, the Nobel Committee reportedly awarded their annual prize in physics Tuesday to Zoomer and Zorbit, two aliens commonly seen driving a tie-dye Volkswagen bug while flashing peace signs. “For their profound advancements in astrophysics, we are pleased to honor this pair of smiling, neon green aliens surrounded by flowers and peace signs with the 2024 Nobel Prize,” said the chairman of the Norwegian Nobel Foundation, posing next to the recipients as they clutched the prestigious gold medal in their three-fingered hands. “These far-out beings have made tremendous strides in traversing the cosmos in nothing but a souped-up VW Beetle with a novelty license plate spelling out ‘PEACE’—something which no other life form in the galaxy has been able to accomplish. Thanks to their scholarship, we all may soon be able to roll our kaleidoscopic vehicles over the rainbow road straight to the glitter-covered surface of Saturn, and we’ll have these two and their message of radical love to thank when we do.” At press time, Zoomer and Zorbit had dedicated their award to their dear friend and collaborator, a purple leopard-print seal."
news,https://theonion.com/what-to-know-about-gray-divorce/,What To Know About ‘Gray Divorce’,"According to researchers, “gray divorce,” a term referring to divorce occurring at age 50 or older, is on the rise. Here is what to know about the increasing divorce rate among older American couples.Q: What makes gray divorce different from regular divorce?A: Old people, who presumably have nothing left to live for, are doing it.Q: What is the divorce rate among elderly couples?A: Enough for twoTimemagazine covers and five segments onFox & Friends.Q: Why is it on the rise?A: The populace has turned its back on the Lord.Q: How is gray divorce affecting families?A: Adult children are being forced to juggle two nursing homes they don’t visit.Q: Can seeing a marriage counselor help?A: Sure, if you want, but they’re very hard to sleep with.Q: How can couples avoid gray divorce?A: By seeking a divorce while they’re still young.Q: When is the right time to ask for a gray divorce?A: He’s been dead for 20 years, grandma."
news,https://theonion.com/scientists-let-defrosted-neanderthal-run-around-shrieking-before-refreezing-him/,Scientists Let Defrosted Neanderthal Run Around Shrieking Before Refreezing Him,"SAN DIEGO—Appearing excited by a change of pace around the lab, researchers at the University of California, San Diego, reportedly laughed and cheered Friday as one of their perfectly preserved Neanderthal specimens regained consciousness and ran around shrieking after it was defrosted. “Releasing him from his cryochamber every so often is important to prevent loss of muscle mass, but the main reason we do it is just to watch him flail around and go absolutely nuts in a world he’s unfamiliar with,” said Professor Garret White, head of the cryogenics lab, who ducked as the Neanderthal flung a beaker, a liquid nitrogen tank, and an electron microscope across the room. “If we’re having a rough week, we may let him out two or even three times just to see the look on his face when he wakes up in the 21st century and has this instant existential breakdown. Our anthropological data suggests he was a feared pack leader around 40,000 years ago, so it’s particularly entertaining to see him get frustrated when the lab’s other Neanderthals, who are still frozen, don’t obey his commands to flay us alive.” White added that when it was time to refreeze the angry Neanderthal, researchers simply handed him a tablet computer and let TikTok’s algorithm lull him into total complacency."
news,https://theonion.com/north-carolina-family-informed-their-insurance-policy-voided-once-house-gets-wet/,North Carolina Family Informed Their Insurance Policy Voided Once House Gets Wet,"ASHEVILLE, NC—Saying he wished there was more he could do to help as he pointed out a clause that showed he didn’t have to, a representative from an insurance company explained to local residents Stan and Loretta Coleman on Thursday that their policy was voided the moment their house got wet. “Unfortunately, the coverage you paid for doesn’t extend to any situation where there is water in, on, or around your home,” said Pat Treacy, a claims adjuster at Countrywide Mutual Insurance who informed the Colemans that their policy had actually been voided the moment they first filled their bathtub or ran water from their sinks. “It’s industry standard, I’m afraid. Houses just aren’t meant to get wet. No insurance company anywhere would take on that kind of liability. If it’s possible to prove the house remained dry during the storm, and it just sort of fell down on its own, then maybe a case could be made for approving your claim.” Treacy went on to wish the Coleman family well and said he would keep an eye out for them on GoFundMe."
news,https://theonion.com/heartbroken-trump-clutches-limp-campaign-lawn-sign-washed-away-in-flood/,Heartbroken Trump Clutches Limp Campaign Lawn Sign Washed Away In Flood,"VALDOSTA, GA—Urging first responders to act quickly after he spotted the placard amongst the wreckage, a heartbroken Donald Trump clutched a limp campaign lawn sign Thursday that had been washed away by Hurricane Helene. “Please, hurry, we don’t have much time,” a visibly panicked Trump said during his visit to a storm-ravaged Georgia town, sobbing after he dropped to his knees, dug through a pile of flood debris, and uncovered a tattered piece of cardboard emblazoned with the words “TRUMP VANCE 2024.” “Stay with me, little buddy. You’re going to be okay. We’re going to fix you up as good as new and put you right back in your family’s front yard where you belong. Then we’ll win this election together. You’ll see!” At press time, sources confirmed Trump had been evacuated by Secret Service and placed under suicide watch after saying he could not allow the sign to die alone and that he would see it in heaven."
news,https://theonion.com/disturbing-video-shows-dunkin-hatchery-workers-tossing-male-donuts-into-industrial-grinder/,Disturbing Video Shows Dunkin’ Hatchery Workers Tossing Male Donuts Into Industrial Grinder,"CANTON, MA—Shining a light on the unsettling realities behind the foods we eat, a disturbing video shot by undercover activists and posted on YouTube Thursday reportedly shows workers at a Dunkin’ hatchery disposing of male donuts in an industrial grinder. “When a donut hatches at one of Dunkin’s production facilities, a professional donut sexer quickly separates the males from the females by squeezing out the donut’s filling and checking its out-turned anal vent for rudimentary male sex sprinkles,” said Boston-based pastry welfare advocate Addie Tapper, explaining that because male donuts are too chewy for human consumption, they’re discarded into the whirring blades of a machine that—as the activists’ footage shows—instantly shreds the hatchlings into lifeless, doughy pulp. “Dunkin’ claims the process is painless and humane, but this video clearly shows a cruller missing the chute and dying a slow, agonizing death on the ground. While it’s heartening to watch these activists secretly transport a handful of male donuts to a baked goods sanctuary in rural Vermont, millions more are dying barbaric deaths every day, all to satisfy America’s insatiable demand for pastry.” The video follows a government report last month that found stress among Coolattas living in filthy, cramped conditions causes the frozen beverages to brutally slurp one another to death."
news,https://theonion.com/vatican-dispatches-micro-missionaries-on-first-ever-trip-to-convert-native-bacteria/,Vatican Dispatches Micro-Missionaries On First-Ever Trip To Convert Native Bacteria,"VATICAN CITY—Saying the effort could bring the Lord’s message to an entirely different scale of life, the Vatican dispatched its first-ever micro-missionaries Wednesday on a trip to convert native bacteria. “The church teaches that God’s glory shines upon all living things, even the heathen E. coli and salmonella bacteria our microscopic pastors will be ministering to,” said Archbishop Francesco Giordano Cacia, who described the painstaking effort that went into outfitting the tiny missionaries with 0.1-micron-wide Bibles and crucifixes far smaller than a grain of sand so that the “benighted microorganisms” might be educated about concepts such as heaven, hell, and the Holy Trinity. “Just because they worship a massive piece of rotting fruit now doesn’t mean these unicellular beings cannot eventually achieve salvation through faith in Jesus Christ. They might lack organelles or an organized nucleus, but we all share in God’s abundant love.” At press time, the Vatican lamented that dozens of spear-wielding bacteria had killed every member of its first micro-mission."
news,https://theonion.com/tylenol-introduces-new-extra-strength-fainting-couch-for-feverish-women/,Tylenol Introduces New Extra-Strength Fainting Couch For Feverish Women,"MONTGOMERY, NJ—Touting faster relief from the symptoms of delirium common to women, Tylenol introduced a new extra-strength fainting couch Thursday for use by feverish consumers. “This fast-acting chaise longue promises instant relief from agonizing hysteria,” said Victoria Holmes, a spokesperson for Tylenol parent company Kenvue, adding that it was already the No. 1 doctor-recommended piece of furniture for patients in the throes of female mania. “Simply drape one hand over your forehead and lie back on the fever-reducing velvet divan for up to six hours of reprieve from the mental turmoil that comes with having no control over one’s emotions. Also suitable for treating aches and pains caused by a too-tight corset or injury from a dizzy spell.” Holmes added that in serious cases of the vapors, it was safe to combine with other remedies, such as having someone shake one’s shoulders while yelling, “Snap out of it!”"
news,https://theonion.com/texas-sex-ed-class-teaches-boys-how-to-cheat-on-pregnant-wife/,Texas Sex Ed Class Teaches Boys How To Cheat On Pregnant Wife,"RICHARDSON, TX—In an effort to help his students one day navigate the harsh realities of an adult relationship, local sex ed teacher Robert Emerson reportedly spent class Wednesday teaching male students how to cheat on their pregnant wives. “Over the 9 months a woman carries a child, her body will change a lot, making it all the more necessary for you to have a hot young slam piece to bang on the side,” Emerson said before telling the room full of seventh-grade boys that it was perfectly natural for a man whose wife is pregnant to want to send flirty messages to beautiful women on social media, give his number to a hot young waitress, or hit on his wife’s attractive younger sister. “At 3 months, you’ll want to keep things casual and mostly send sexually explicit photos to your ‘lady friend.’ Then, by 6 months, you’ll likely have escalated to meeting up on weeknights at a local motel. By 9 months, your wife will definitely be suspicious and demand to see your phone, but that’s when you gaslight her and tell her she’s crazy.” According to sources, Emerson later distributed sacks of flour to all his students to simulate what it’s like to be a father turning his young child against their mother after a divorce."
news,https://theonion.com/man-thinks-his-dog-is-office-mascot/,Man Thinks His Dog Is Office Mascot,"BURLINGTON, VT—Though the man is met with little more than polite smiles and indifferent nods as he brings his dog around from cubicle to cubicle, sources at Patterson Technologies confirmed Tuesday that employee Kyle Lutz thinks his 2-year-old terrier mix is the office’s mascot. “Everyone loves it when I bring Comet into work, and in a way, I think he represents what this place is all about,” said Lutz, who is apparently oblivious to the fact that three quarters of his coworkers do not know the name of his dog and many try to look busy as he walks past so they do not have to interact with the animal. “He has this go-getter spirit that perks everyone up, and his fresh attitude really reflects our office culture. I always tell HR they should have him sit in on job interviews, because if a candidate doesn’t love Comet, you’ll know right away they aren’t a good fit forthiscompany!” At press time, after bringing his dog into the sales team’s meeting with a potential client and hollering, “This little guy right here is what it’s all about!” Lutz had reportedly been fired."
news,https://theonion.com/jimmy-carter-holds-open-casket-birthday-party/,Jimmy Carter Holds Open-Casket Birthday Party,Content not found
