type,link,title,text
local,https://theonion.com/couple-denied-marriage-license-after-failing-to-prove-love-beyond-reasonable-doubt/,Couple Denied Marriage License After Failing To Prove Love Beyond Reasonable Doubt,"KANSAS CITY, MO—Falling short of the high burden of proof demanded in the courthouse, area couple Alice Fields and Zachary Garcia were reportedly denied a marriage license Tuesday after failing to prove their love beyond a reasonable doubt. “Although in common terms the two of you may be considered in love, it is the duty of this court to follow a certain standard of evidence, and your relationship must be presumed casual until it is proven serious,” said Judge Luther Hanscom, whose ruling found insufficient grounds to suggest Fields and Garcia’s bond was meant to last forever, concluding it was plausible they were participants in nothing more than a simple fling. “You have not provided the necessary love letters or the breathless texts to your friends after your first date to substantiate a legal claim that you are two halves of a shared, sacred whole. Even as I look at you now, I can see no body language indicating a level of romantic chemistry sufficient to warrant a marriage license. Your affection, though it may exist, is just not at the threshold of making me hear wedding bells when you gaze into each other’s eyes.” At press time, sources confirmed the couple had successfully appealed the ruling after Garcia gave his fiancée a tennis bracelet that must have cost at least $800."
local,https://theonion.com/mom-spends-15-minutes-hearting-every-message-from-last-5-days-of-family-group-chat/,Mom Spends 15 Minutes Hearting Every Message From Last 5 Days Of Family Group Chat,"RICHMOND, VA—In an attempt to make clear her feelings of emotional warmth toward their texts and photos, local mom Susan Barnes reportedly spent 15 minutes of her Thursday morning combing through the past five days of her family’s group chat and adding a heart emoji to each message. “My phone was blowing up every 10 seconds, so I finally just turned it off until she was done liking everything,” said Alex Barnes, 16, whose sole contributions to the group chat during the five-day period were a confirmation of when he needed to be picked up from soccer practice and a text indicating “ok” when he was informed dinner was ready. “The only messages in our chat that don’t have any kind of engagement are hers—which are usually pictures of sunsets, detailed updates on the health of our grandparents, or just long run-on sentences that no one ever makes it to the end of. Occasionally, though, she’ll like one of her own photos of us spending time together.” At press time, Barnes family members confirmed their mother had sent a message that consisted of nothing but a large red heart emoji and had then added a heart reaction to the heart."
local,https://theonion.com/ambulance-driver-pretty-embarrassed-she-did-all-that-just-to-go-three-blocks/,Ambulance Driver Pretty Embarrassed She Did All That Just To Go Three Blocks,"MINNEAPOLIS—Admitting her knee-jerk response seemed to have been an overreaction, local ambulance driver Tara Stanton told reporters Wednesday that she was pretty embarrassed she did all of that just to go three blocks. “Oh jeez, if I’d known the guy’s apartment was this close, I never would’ve leaned on the horn and run all those red lights,” said Stanton, who meekly turned off her siren, exited the emergency vehicle, and grew visibly red with humiliation as she looked back a mere 300 yards to the firehouse from which she’d been dispatched. “I totally tore through that intersection at, like, 90 miles per hour, and cut off a few cars, too. I feel really bad if that car crash was because of me. Darn. We probably could have just walked.” At press time, Stanton added that she felt particularly ashamed after realizing the patient whose call she was responding to had already passed away during her 27-second drive."
local,https://theonion.com/grandma-who-survived-great-depression-casually-drops-that-she-once-killed-man-for-mayonnaise/,Grandma Who Survived Great Depression Casually Drops That She Once Killed Man For Mayonnaise,"LOUISVILLE, KY—In a wide-ranging conversation about the hardships and difficult choices her family had faced during the Great Depression, local grandmother Mary Sipple casually mentioned Tuesday that in August 1937 she took the life of a man who refused to give up a jar of mayonnaise. “She just crushed his skull with a rock and said a prayer while he bled out,” said Sipple’s granddaughter Sarah Green, explaining that her grandmother had managed to make the mayonnaise last until spring, right around the time the dead man’s body—which she had carefully weighed down and dumped into the Ohio River—washed up in the next county. “Grandma told me she was tired of having nothing to put between two slices of bread. So when she saw the man with his jar of Hellmann’s, she made him a proposition: He could either give her the mayonnaise, or he could die. I asked her how she felt about this now, and she just said sandwich spreads were hard to come by back then and the man had made his choice.” At press time, Sipple was reportedly listing on her fingers the various other items—eggs, flour, chewing gum, an Indian head nickel—she had killed people over during the worst economic crisis in American history."
local,https://theonion.com/man-starting-to-worry-mole-on-his-tumor-might-be-cancerous/,Man Starting To Worry Mole On His Tumor Might Be Cancerous,Content not found
local,https://theonion.com/coworker-asking-if-anyone-can-cover-his-weekend-with-daughters/,Coworker Asking If Anyone Can Cover His Weekend With Daughters,"SPOKANE, WA—Saying anyone who could swing it would be doing him a “huge solid,” 38-year-old data entry clerk Darryl Bouchard reportedly asked his coworkers Monday if one of them could cover his weekend with his daughters. “Hey, guys, sorry this is such short notice, but is there any chance somebody could pick up my custody weekend with Katie and Sarah?” said Bouchard to his coworkers, adding that something important had just come up that conflicted with his regular court-ordered parenting schedule. “The girls are usually pretty quiet on weekends, so all you’d have to do is feed them, put them to bed, and maybe take them to a Sabrina Carpenter concert if you can manage it. I know nobody wants to spend their weekend hanging out with my kids, but I’m really up against the wall here. I’d be glad to return the favor any weekend when a friend hasn’t scored free Seahawks tickets and invited me to come with him.” At press time, sources confirmed Bouchard had texted again to see if one of his coworkers could fill in for him at an upcoming family court hearing."
local,https://theonion.com/modern-day-magellan-discovers-new-dining-options-by-zooming-in-a-little-on-google-maps/,Modern-Day Magellan Discovers New Dining Options By Zooming In A Little On Google Maps,"PORTLAND, OR—Demonstrating an ability to uncover previously uncharted territories not seen since the Portuguese explorer circumnavigated the globe, 32-year-old Nate Sulzer, a modern-day Ferdinand Magellan, reportedly discovered new dining options Monday by zooming in a little on Google Maps. “Oh cool, it looks like there’s a pretty good Thai place a few blocks over,” said the intrepid explorer, placing a finger and thumb on his phone screen and moving them apart slightly to reveal several more restaurants and coffee shops, which appeared before him like the islands of Tierra del Fuego materializing out of the South American mists. Sulzer then told his friends—in manner that recalled the famed 16th-century admiral lowering a brass telescope from his eyes to sketch out his destination on a parchment map before the stunned sailors of theTrinidad—that one restaurant was apparently BYOB.“You couldn’t see it before, but I guess if you jiggle the screen around a little bit, sometimes more stuff shows up. There’s a burger place, too.” At press time, sources confirmed that the employees at a local buffalo wing restaurant were warmly greeting Sulzer and his friends like natives welcoming Magellan’s crew, unbeknownst to the horrors that awaited them."
local,https://theonion.com/man-thinks-his-dog-is-office-mascot/,Man Thinks His Dog Is Office Mascot,"BURLINGTON, VT—Though the man is met with little more than polite smiles and indifferent nods as he brings his dog around from cubicle to cubicle, sources at Patterson Technologies confirmed Tuesday that employee Kyle Lutz thinks his 2-year-old terrier mix is the office’s mascot. “Everyone loves it when I bring Comet into work, and in a way, I think he represents what this place is all about,” said Lutz, who is apparently oblivious to the fact that three quarters of his coworkers do not know the name of his dog and many try to look busy as he walks past so they do not have to interact with the animal. “He has this go-getter spirit that perks everyone up, and his fresh attitude really reflects our office culture. I always tell HR they should have him sit in on job interviews, because if a candidate doesn’t love Comet, you’ll know right away they aren’t a good fit forthiscompany!” At press time, after bringing his dog into the sales team’s meeting with a potential client and hollering, “This little guy right here is what it’s all about!” Lutz had reportedly been fired."
local,https://theonion.com/ethnic-name-copied-and-pasted-into-email/,Ethnic Name Copied And Pasted Into Email,Content not found
local,https://theonion.com/sustainably-minded-hit-man-suffocates-victim-using-reusable-tote/,Sustainably Minded Hit Man Suffocates Victim Using Reusable Tote,Content not found
local,https://theonion.com/friend-sets-inescapable-social-trap-with-3-possible-dates-to-hang-out/,Friend Sets Inescapable Social Trap With 3 Possible Dates To Hang Out,"SANTA CLARITA, CA—Staring down at the text message in horror and realizing that he had been brilliantly outplayed, local man Jonathan Garner told reporters Monday that his friend had set an inescapable social trap by proposing three possible dates to hang out. “Goddamn it, he got me—how am I supposed to get out of grabbing drinks on either Wednesday night, Sunday afternoon, or two Fridays from now?” said Garner, who hung his head in frustration after realizing that his overeager, socially starved friend had spent months slowly backing him into a corner until he finally ran out of plausible excuses to meet up for a couple of hours. “Even if I somehow get out of hanging out this Wednesday and Sunday, there’s no way I can say I’m still ‘super busy with work’ two weeks from now. God, I’m such an asshole. Maybe I’ll just say something vague, like some family stuff came up.” At press time, Garner could reportedly be heard screaming in agony after his friend put the final nail in his coffin with a polite “No worries, I’m happy to work around your schedule!”"
local,https://theonion.com/hit-man-opens-guitar-case-concealing-guitar-he-going-to-beat-targets-ass-with/,Hit Man Opens Guitar Case Concealing Guitar He Going To Beat Target’s Ass With,"SAN ANTONIO—Breezing past security in the guise of a musician and entering the ballroom where his target was attending a cocktail party, area hit man Don Meston reportedly opened a guitar case Friday in which he had concealed the guitar he planned to beat his victim’s ass with. “There were guards out front, but I kept a low profile and slipped right through—along with a little present for our friend,” Meston radioed to his handler, looking left and right before ducking into an out-of-the-way utility closet where he uncased the hidden Gibson Les Paul, attached a strap so he could carry it comfortably over his shoulder, and turned all the instrument’s knobs up to 10. “I’ll try to smack the shit out of the target quick and clean. Keep the car running, though, because if he puts up a fight, I may have to whale on his ass for a while before I can make my getaway.” At press time, witnesses confirmed security had subdued the contract killer after he paused in the middle of carrying out his hit to check the guitar’s tuning."
local,https://theonion.com/food-used-as-napkin/,Food Used As Napkin,Content not found
local,https://theonion.com/man-becomes-first-in-his-family-to-go-to-bed/,Man Becomes First In His Family To Go To Bed,"MANCHESTER, NH—Posing in his pajamas as his proud mother took a photo to capture the momentous occasion, local man Frederico Torres became the first person in his family to go to bed, sources confirmed Thursday. “When my family first came to this country, none of them ever had the opportunity to go to bed, it felt like a luxury for the rich,” said Torres, who noted that his grandfather almost went to bed after fighting in Vietnam, but had to get a job when his grandmother got pregnant. “Of course I feel kind of privileged, but I’m thankful for all the generations of my family who sacrificed so I could cozy up under the blankets. I’m actually nervous because I don’t want to waste my time in bed by tossing and turning and let my family down. My dad really encouraged me because it was always his dream to go to bed, but he never had the chance.” At press time, Torres had incurred $45,000 of debt after his first week in bed."
local,https://theonion.com/yoga-teacher-puts-hand-on-small-of-students-back-but-in-parking-lot/,"Yoga Teacher Puts Hand On Small Of Student’s Back, But In Parking Lot","HARTFORD, CT—Telling her to close her eyes and turn inward as he gently guided her positioning, local yoga teacher Vincent Diaz reportedly placed his hand on the small of student Ellie Cruz’s back Thursday, but in the parking lot. “It’s okay to get a little tense, but don’t resist too much because that’s how you hurt yourself,” said the instructor who gently whispered to Cruz as he gripped her thighs just 10 yards from the strip mall’s nail salon. “Just lose yourself in your heavy breathing, focus on that and just let what needs to happen, happen. It’s okay to sweat, it just shows that it’s working. You’re a natural, Ellie, but you really should be doing this more regularly so you get more comfortable. It gets better with experience.” At press time, Cruz received a request for $150 from her yoga teacher for providing a private lesson."
local,https://theonion.com/dad-insists-on-using-pocketknife-to-open-can-of-chili/,Dad Insists On Using Pocketknife To Open Can Of Chili,"ALEXANDRIA, VA—Delighting in the opportunity to make use of the tool he carried with him everywhere, local father Kevin Ballard reportedly insisted on using his pocketknife Wednesday to open a can of chili. “Hang on, there’s no need to go looking high and low for the can opener—I’ve got this covered right here,” said the marketing manager and father of three, fishing out the small item from his pocket and struggling for several seconds to open the one-inch blade. “Luckily, I never go anywhere without this baby, so I’m totally equipped for a situation like this one. It’s so much better to have a knife with you and not need it than it is tonothave a knife and be in one of these tight spots where you do need it. See? All I need to do now is jam the blade into the side here and…no. Well, what if I sort of saw it, like this? Then—aw, shit, that hurts!” At press time, the man’s daughter, Jennifer Ballard, was said to have thrown out the partially opened can of chili after determining it had too much blood on it to be edible."
local,https://theonion.com/woman-reaches-arm-deep-into-purse-like-farmer-artificially-inseminating-cow/,Woman Reaches Arm Deep Into Purse Like Farmer Artificially Inseminating Cow,Content not found
sports,https://theonion.com/travis-kelce-suffers-film-career-beginning-injury/,Travis Kelce Suffers Film-Career-Beginning Injury,"KANSAS CITY, MO—In a stunning turn of events that shocked fans during the Chiefs’ game against the New Orleans Saints, sources confirmed Monday night that 34-year-old tight end Travis Kelce had suffered a film-career-beginning injury. “Folks, that was a big hit that Kelce clearly wasn’t prepared for, and he’s been down for several minutes—you can already see him consulting with his agent to see whether there’s any chance of him walking off this field and directly onto the set of a rom-com,” saidMonday Night Footballplay-by-play announcer Joe Buck, describing the catastrophic lower-leg injury expected to leave Kelce confined to movie and television roles for the remainder of his life. “The medical staff are doing their best to apply makeup for a new round of headshots. We can only hope there’s a chance of him coming back as America’s everyman. It’s an incredibly somber night at Arrowhead Stadium.” At press time, both teams had reportedly taken knees at the sidelines to pray that Kelce’s first film saw strong box office returns."
sports,https://theonion.com/deion-sanders-admits-he-has-no-idea-what-school-colorado-buffaloes-play-for/,Deion Sanders Admits He Has No Idea What School Colorado Buffaloes Play For,"BOULDER, CO—Emphasizing that he was primarily focused on running the football team, head coach Deion Sanders admitted to reporters Wednesday that he has absolutely zero idea what school the Colorado Buffaloes play for. “Look, my job is to devote my full attention to making sure the offense puts points on the scoreboard and the defense stops the opposing team—anything else is just a distraction,” said Sanders, adding that he assumed the team had ties to “Buff State,” “Buffalo Tech,” or “Nebraska.” “You could ask the players, but I doubt they would know either. Oh! Buffalo University! Is that correct? It sounds kind of familiar. I’m pretty sure I’ve seen the campus, but that might have just been a parking lot near the football field. If I’m being honest, I don’t care.” Sanders went on to ask reporters what the people in the stadium do when football games aren’t happening."
sports,https://theonion.com/nfl-referee-under-fire-for-watching-porn-on-instant-replay-device/,NFL Referee Under Fire For Watching Porn On Instant Replay Device,"DALLAS—Facing serious consequences for multiple violations of the league’s HR guidelines, local NFL referee Greg Clancy reportedly came under fire this weekend for watching pornography on his work instant replay device. “Unfortunately, Mr. Clancy was caught using his device for inappropriate conduct in a blatant breach of the employee code prohibiting pornography in the workplace,” NFL representatives said in an official statement that described how Clancy’s indiscretions were initially flagged via a virus downloaded from an adult website called XXXFL.net, along with accusations of delayed penalty calls, multiple incidents of explicit videos flashing on the Jumbotron screen for brief moments, and a tendency for the referee to take the instant replay device with him into the stadium bathrooms for long stretches of time. “When we intercepted several messages from his device from a hot, horny MILF who lives nearby, it became clear that Clancy was abusing his work technology for personal sexual gratification. Even worse, Clancy would call over other officials, urging them to ‘check this out.’ This breach of conduct has no place in the NFL, especially from those responsible for enforcing the rules, and he will be disciplined accordingly.” At press time, authorities confirmed that the referee would be placed under a supervision plan and watched over by an HR representative during all upcoming games."
sports,https://theonion.com/nfl-sunday-ticket-allows-viewers-to-simulcast-up-to-4-domestic-violence-trials-at-once/,NFL Sunday Ticket Allows Viewers To Simulcast Up To 4 Domestic Violence Trials At Once,"NEW YORK—Offering football fans the chance to catch every testimony and cross-examination without having to change the channel, NFL Sunday Ticket announced this week that it is now allowing viewers to simulcast up to four domestic violence trials at the same time. “It used to be that we would only have one or two big domestic violence trials with our players, but as the league has grown, fans started to complain that there were sometimes eight different trials they wanted to watch going on at the same time,” said NFL head of marketing Tim Ellis, adding that many fans want to catch local domestic violence trials outside of their market because it looks like a good matchup or has big fantasy implications. “It used to be that you’d be watching the defense on one trial as it tried to discredit the accuser and not realize you were missing a handgun being entered into evidence over on another channel, but with our new ‘NFL Grand Jury’ package on Sunday Ticket you can keep an eye on multiple trials at once and go full screen when the action heats up. It starts at $249.99 but that gets you hundreds of different domestic violence suits to choose from during the year, including civil suits, and the package covers related gun, drug, and reckless driving trials. It’s the best way to watch all the biggest stars in the NFL.” Ellis added that while Grand Jury subscribers will have access to almost every domestic violence trial, the package will not cover NFL Thursday Trials that are licensed exclusively to Amazon Prime."
sports,https://theonion.com/ohtani-cashes-in-50-home-run-futures-bet-ticket/,Ohtani Cashes In 50-Home-Run Futures Bet Ticket,Content not found
sports,https://theonion.com/tom-brady-provides-detailed-analysis-of-how-easy-it-would-be-for-him-to-take-dak-prescotts-job/,Tom Brady Provides Detailed Analysis Of How Easy It Would Be For Him To Take Dak Prescott’s Job,"CLEVELAND—Covering the Browns vs. Cowboys game for his highly anticipated Fox Sports broadcasting debut, Tom Brady provided a detailed analysis Sunday of how easy it would be for him to take Dallas quarterback Dak Prescott’s job. “As someone who competed in the NFL against Dak for seven seasons, I know his game very well, and let me just say, with one quick text to Jerry Jones, I could be on the field as the Cowboys starting quarterback next week,” said Brady, who, along with his broadcasting partner Kevin Burkhardt, then proceeded to pull up a screen and scrawl the words “Tom Brady” and “just show up” to diagram exactly how he would come out of retirement for a second time and immediately steal Prescott’s job, title, and four-year, $160 million contract. “First, I’d exert pressure on the coaching staff by saying ‘seven Super Bowl wins.’ Then, I’d make a big fuss about how I’ve been having second thoughts about this whole sports broadcaster thing. Fast-forward a couple of days, and I’m in Dallas wearing a Cowboy’s jersey and the whole team is calling me ‘Captain Tom Brady.’ Watch. I could do it right now.” At press time, Brady also provided a detailed analysis of how easy it would be for him to take Prescott’s girlfriend and get the quarterback’s daughter to call him “Dad.”"
sports,https://theonion.com/bengals-coaching-staff-holding-breath-after-joe-burrow-endures-rough-high-five/,Bengals Coaching Staff Holding Breath After Joe Burrow Endures Rough High-Five,"CINCINNATI—Wincing at the sound of the two palms coming into contact with each other, the Cincinnati Bengals coaching staff reportedly held its breath Sunday after Joe Burrow endured a rough high-five from a teammate. “Oof, that looked like it hurt,” said commentator Ian Eagle, who narrated a replay of the congratulatory gesture showing the 27-year-old Bengals quarterback yelping, recoiling, and tumbling to the ground in pain, the skin of his hand visibly reddened. “That was absolutely brutal. Bengals head coach Zac Taylor looks like he’s in a state of shock. Hopefully Burrow can recover, but I wouldn’t be surprised if he’s out for the season. And it looks like they’re taking him to the tent now. All we can do is pray.” At press time, the incident had led to renewed calls for players to wear thicker gloves."
sports,https://theonion.com/stephen-nedoroscik-under-fire-after-video-shows-him-whi-1851616068rev1723128732701/,Stephen Nedoroscik Under Fire After Video Shows Him Whipping Pommel Horse,"PARIS—Sending waves of shock and outrage throughout the sporting world, U.S. gymnast Stephen Nedoroscik was under fire Thursday after a newly surfaced video showed the Olympic athlete whipping a pommel horse. “That poor pommel horse—it was just standing there, cowering, as he struck it again and again,” said American gymnast Asher Hong, condemning what he called the “cruel” behavior in the video, which captured Nedoroscik repeatedly beating the pommel horse and led USA Gymnastics to suspend the 25-year-old bronze medalist from competition for the next six months. “You could tell it was traumatized. Completely frozen. Even if he was just trying to train it, there is absolutely no excuse for that kind of behavior. At the very least, he should consider making a sizable donation to a farm for retired pommel horses.” At press time, Olympic officials reportedly launched an investigation after a pommel horse was found oozing foam."
